[INFO] Scanning for projects...
[INFO] 
[INFO] ----------------< com.example:custom-identity-provider >----------------
[INFO] Building custom-identity-provider 0.0.1-SNAPSHOT
[INFO]   from pom.xml
[INFO] --------------------------------[ jar ]---------------------------------
[INFO] 
[INFO] --- clean:3.4.0:clean (default-clean) @ custom-identity-provider ---
[INFO] Deleting /Users/fabian/Documents/CodeProjects/github.com/fabiankaraben/java-mini-projects/advanced/41-custom-identity-provider/target
[INFO] 
[INFO] --- resources:3.3.1:resources (default-resources) @ custom-identity-provider ---
[INFO] Copying 1 resource from src/main/resources to target/classes
[INFO] Copying 0 resource from src/main/resources to target/classes
[INFO] 
[INFO] --- compiler:3.13.0:compile (default-compile) @ custom-identity-provider ---
[INFO] Recompiling the module because of changed source code.
[INFO] Compiling 2 source files with javac [debug parameters release 17] to target/classes
[WARNING] /Users/fabian/Documents/CodeProjects/github.com/fabiankaraben/java-mini-projects/advanced/41-custom-identity-provider/src/main/java/com/example/authserver/config/SecurityConfig.java:[48,55] applyDefaultSecurity(org.springframework.security.config.annotation.web.builders.HttpSecurity) in org.springframework.security.oauth2.server.authorization.config.annotation.web.configuration.OAuth2AuthorizationServerConfiguration has been deprecated and marked for removal
[INFO] /Users/fabian/Documents/CodeProjects/github.com/fabiankaraben/java-mini-projects/advanced/41-custom-identity-provider/src/main/java/com/example/authserver/config/SecurityConfig.java: /Users/fabian/Documents/CodeProjects/github.com/fabiankaraben/java-mini-projects/advanced/41-custom-identity-provider/src/main/java/com/example/authserver/config/SecurityConfig.java uses or overrides a deprecated API.
[INFO] /Users/fabian/Documents/CodeProjects/github.com/fabiankaraben/java-mini-projects/advanced/41-custom-identity-provider/src/main/java/com/example/authserver/config/SecurityConfig.java: Recompile with -Xlint:deprecation for details.
[INFO] 
[INFO] --- resources:3.3.1:testResources (default-testResources) @ custom-identity-provider ---
[INFO] skip non existing resourceDirectory /Users/fabian/Documents/CodeProjects/github.com/fabiankaraben/java-mini-projects/advanced/41-custom-identity-provider/src/test/resources
[INFO] 
[INFO] --- compiler:3.13.0:testCompile (default-testCompile) @ custom-identity-provider ---
[INFO] Recompiling the module because of changed dependency.
[INFO] Compiling 2 source files with javac [debug parameters release 17] to target/test-classes
[INFO] 
[INFO] --- surefire:3.5.2:test (default-test) @ custom-identity-provider ---
[INFO] Using auto detected provider org.apache.maven.surefire.junitplatform.JUnitPlatformProvider
[INFO] 
[INFO] -------------------------------------------------------
[INFO]  T E S T S
[INFO] -------------------------------------------------------
[INFO] Running com.example.authserver.AuthServerIntegrationTest
00:33:03.933 [main] INFO org.springframework.test.context.support.AnnotationConfigContextLoaderUtils -- Could not detect default configuration classes for test class [com.example.authserver.AuthServerIntegrationTest]: AuthServerIntegrationTest does not declare any static, non-private, non-final, nested classes annotated with @Configuration.
00:33:03.988 [main] INFO org.springframework.boot.test.context.SpringBootTestContextBootstrapper -- Found @SpringBootConfiguration com.example.authserver.AuthServerApplication for test class com.example.authserver.AuthServerIntegrationTest

  .   ____          _            __ _ _
 /\\ / ___'_ __ _ _(_)_ __  __ _ \ \ \ \
( ( )\___ | '_ | '_| | '_ \/ _` | \ \ \ \
 \\/  ___)| |_)| | | | | || (_| |  ) ) ) )
  '  |____| .__|_| |_|_| |_\__, | / / / /
 =========|_|==============|___/=/_/_/_/

 :: Spring Boot ::                (v3.4.1)

2026-02-12T00:33:04.151-03:00  INFO 3361 --- [           main] c.e.a.AuthServerIntegrationTest          : Starting AuthServerIntegrationTest using Java 25.0.2 with PID 3361 (started by fabian in /Users/fabian/Documents/CodeProjects/github.com/fabiankaraben/java-mini-projects/advanced/41-custom-identity-provider)
2026-02-12T00:33:04.152-03:00  INFO 3361 --- [           main] c.e.a.AuthServerIntegrationTest          : No active profile set, falling back to 1 default profile: "default"
2026-02-12T00:33:04.478-03:00 TRACE 3361 --- [           main] eGlobalAuthenticationAutowiredConfigurer : Eagerly initializing {securityConfig=com.example.authserver.config.SecurityConfig$$SpringCGLIB$$0@7fb66650}
2026-02-12T00:33:04.479-03:00  WARN 3361 --- [           main] o.s.security.core.userdetails.User       : User.withDefaultPasswordEncoder() is considered unsafe for production and is only intended for sample applications.
2026-02-12T00:33:04.586-03:00  INFO 3361 --- [           main] r$InitializeUserDetailsManagerConfigurer : Global AuthenticationManager configured with UserDetailsService bean with name userDetailsService
WARNING: A restricted method in java.lang.System has been called
WARNING: java.lang.System::load has been called by org.apache.tomcat.jni.Library in an unnamed module (file:/Users/fabian/.m2/repository/org/apache/tomcat/embed/tomcat-embed-core/10.1.34/tomcat-embed-core-10.1.34.jar)
WARNING: Use --enable-native-access=ALL-UNNAMED to avoid a warning for callers in this module
WARNING: Restricted methods will be blocked in a future release unless native access is enabled

2026-02-12T00:33:04.890-03:00 DEBUG 3361 --- [           main] o.s.s.web.DefaultSecurityFilterChain     : Will secure org.springframework.security.oauth2.server.authorization.config.annotation.web.configurers.OAuth2AuthorizationServerConfigurer$$Lambda/0x00001000013f1ab8@28279a49 with filters: DisableEncodeUrlFilter, WebAsyncManagerIntegrationFilter, SecurityContextHolderFilter, AuthorizationServerContextFilter, HeaderWriterFilter, CsrfFilter, OidcLogoutEndpointFilter, LogoutFilter, OAuth2AuthorizationServerMetadataEndpointFilter, OAuth2AuthorizationEndpointFilter, OAuth2DeviceVerificationEndpointFilter, OidcProviderConfigurationEndpointFilter, NimbusJwkSetEndpointFilter, OAuth2ClientAuthenticationFilter, BearerTokenAuthenticationFilter, RequestCacheAwareFilter, SecurityContextHolderAwareRequestFilter, AnonymousAuthenticationFilter, ExceptionTranslationFilter, AuthorizationFilter, OAuth2TokenEndpointFilter, OAuth2TokenIntrospectionEndpointFilter, OAuth2TokenRevocationEndpointFilter, OAuth2DeviceAuthorizationEndpointFilter, OidcUserInfoEndpointFilter
2026-02-12T00:33:04.893-03:00 DEBUG 3361 --- [           main] o.s.s.web.DefaultSecurityFilterChain     : Will secure any request with filters: DisableEncodeUrlFilter, WebAsyncManagerIntegrationFilter, SecurityContextHolderFilter, HeaderWriterFilter, CsrfFilter, LogoutFilter, UsernamePasswordAuthenticationFilter, DefaultResourcesFilter, DefaultLoginPageGeneratingFilter, DefaultLogoutPageGeneratingFilter, RequestCacheAwareFilter, SecurityContextHolderAwareRequestFilter, AnonymousAuthenticationFilter, ExceptionTranslationFilter, AuthorizationFilter
2026-02-12T00:33:05.001-03:00  INFO 3361 --- [           main] o.s.b.t.m.w.SpringBootMockServletContext : Initializing Spring TestDispatcherServlet ''
2026-02-12T00:33:05.002-03:00  INFO 3361 --- [           main] o.s.t.web.servlet.TestDispatcherServlet  : Initializing Servlet ''
2026-02-12T00:33:05.002-03:00  INFO 3361 --- [           main] o.s.t.web.servlet.TestDispatcherServlet  : Completed initialization in 0 ms
2026-02-12T00:33:05.013-03:00  INFO 3361 --- [           main] c.e.a.AuthServerIntegrationTest          : Started AuthServerIntegrationTest in 0.966 seconds (process running for 1.38)
Mockito is currently self-attaching to enable the inline-mock-maker. This will no longer work in future releases of the JDK. Please add Mockito as an agent to your build what is described in Mockito's documentation: https://javadoc.io/doc/org.mockito/mockito-core/latest/org/mockito/Mockito.html#0.3
Java HotSpot(TM) 64-Bit Server VM warning: Sharing is only supported for boot loader classes because bootstrap classpath has been appended
WARNING: A Java agent has been loaded dynamically (/Users/fabian/.m2/repository/net/bytebuddy/byte-buddy-agent/1.15.11/byte-buddy-agent-1.15.11.jar)
WARNING: If a serviceability tool is in use, please run with -XX:+EnableDynamicAgentLoading to hide this warning
WARNING: If a serviceability tool is not in use, please run with -Djdk.instrument.traceUsage for more information
WARNING: Dynamic loading of agents will be disallowed by default in a future release
WARNING: A terminally deprecated method in sun.misc.Unsafe has been called
WARNING: sun.misc.Unsafe::objectFieldOffset has been called by net.bytebuddy.dynamic.loading.ClassInjector$UsingUnsafe$Dispatcher$CreationAction (file:/Users/fabian/.m2/repository/net/bytebuddy/byte-buddy/1.17.1/byte-buddy-1.17.1.jar)
WARNING: Please consider reporting this to the maintainers of class net.bytebuddy.dynamic.loading.ClassInjector$UsingUnsafe$Dispatcher$CreationAction
WARNING: sun.misc.Unsafe::objectFieldOffset will be removed in a future release
2026-02-12T00:33:05.410-03:00 TRACE 3361 --- [           main] o.s.security.web.FilterChainProxy        : Trying to match request against DefaultSecurityFilterChain defined as 'authorizationServerSecurityFilterChain' in [class path resource [com/example/authserver/config/SecurityConfig.class]] matching [org.springframework.security.oauth2.server.authorization.config.annotation.web.configurers.OAuth2AuthorizationServerConfigurer$$Lambda/0x00001000013f1ab8@28279a49] and having filters [DisableEncodeUrl, WebAsyncManagerIntegration, SecurityContextHolder, AuthorizationServerContext, HeaderWriter, Csrf, OidcLogoutEndpoint, Logout, OAuth2AuthorizationServerMetadataEndpoint, OAuth2AuthorizationEndpoint, OAuth2DeviceVerificationEndpoint, OidcProviderConfigurationEndpoint, NimbusJwkSetEndpoint, OAuth2ClientAuthentication, BearerTokenAuthentication, RequestCacheAware, SecurityContextHolderAwareRequest, AnonymousAuthentication, ExceptionTranslation, Authorization, OAuth2TokenEndpoint, OAuth2TokenIntrospectionEndpoint, OAuth2TokenRevocationEndpoint, OAuth2DeviceAuthorizationEndpoint, OidcUserInfoEndpoint] (1/2)
2026-02-12T00:33:05.410-03:00 DEBUG 3361 --- [           main] o.s.security.web.FilterChainProxy        : Securing GET /oauth2/authorize
2026-02-12T00:33:05.411-03:00 TRACE 3361 --- [           main] o.s.security.web.FilterChainProxy        : Invoking DisableEncodeUrlFilter (1/25)
2026-02-12T00:33:05.411-03:00 TRACE 3361 --- [           main] o.s.security.web.FilterChainProxy        : Invoking WebAsyncManagerIntegrationFilter (2/25)
2026-02-12T00:33:05.411-03:00 TRACE 3361 --- [           main] o.s.security.web.FilterChainProxy        : Invoking SecurityContextHolderFilter (3/25)
2026-02-12T00:33:05.412-03:00 TRACE 3361 --- [           main] o.s.security.web.FilterChainProxy        : Invoking AuthorizationServerContextFilter (4/25)
2026-02-12T00:33:05.412-03:00 TRACE 3361 --- [           main] o.s.security.web.FilterChainProxy        : Invoking HeaderWriterFilter (5/25)
2026-02-12T00:33:05.413-03:00 TRACE 3361 --- [           main] o.s.security.web.FilterChainProxy        : Invoking CsrfFilter (6/25)
2026-02-12T00:33:05.414-03:00 TRACE 3361 --- [           main] o.s.security.web.csrf.CsrfFilter         : Did not protect against CSRF since request did not match And [CsrfNotRequired [TRACE, HEAD, GET, OPTIONS], Not [Or [Or [Or [Ant [pattern='/oauth2/token', POST], Ant [pattern='/oauth2/introspect', POST], Ant [pattern='/oauth2/revoke', POST], Ant [pattern='/oauth2/device_authorization', POST]], Ant [pattern='/.well-known/oauth-authorization-server', GET], Or [Ant [pattern='/oauth2/authorize', GET], Ant [pattern='/oauth2/authorize', POST]], Ant [pattern='/oauth2/token', POST], Ant [pattern='/oauth2/introspect', POST], Ant [pattern='/oauth2/revoke', POST], Ant [pattern='/oauth2/device_authorization', POST], Or [Ant [pattern='/oauth2/device_verification', GET], Ant [pattern='/oauth2/device_verification', POST]], Or [Ant [pattern='/.well-known/openid-configuration', GET], Or [Ant [pattern='/connect/logout', GET], Ant [pattern='/connect/logout', POST]], Or [Ant [pattern='/userinfo', GET], Ant [pattern='/userinfo', POST]]], Ant [pattern='/oauth2/jwks', GET]], org.springframework.security.config.annotation.web.configurers.oauth2.server.resource.OAuth2ResourceServerConfigurer$BearerTokenRequestMatcher@164642a4]]]
2026-02-12T00:33:05.414-03:00 TRACE 3361 --- [           main] o.s.security.web.FilterChainProxy        : Invoking OidcLogoutEndpointFilter (7/25)
2026-02-12T00:33:05.414-03:00 TRACE 3361 --- [           main] o.s.security.web.FilterChainProxy        : Invoking LogoutFilter (8/25)
2026-02-12T00:33:05.414-03:00 TRACE 3361 --- [           main] o.s.s.w.a.logout.LogoutFilter            : Did not match request to Ant [pattern='/logout', POST]
2026-02-12T00:33:05.414-03:00 TRACE 3361 --- [           main] o.s.security.web.FilterChainProxy        : Invoking OAuth2AuthorizationServerMetadataEndpointFilter (9/25)
2026-02-12T00:33:05.414-03:00 TRACE 3361 --- [           main] o.s.security.web.FilterChainProxy        : Invoking OAuth2AuthorizationEndpointFilter (10/25)
2026-02-12T00:33:05.415-03:00 TRACE 3361 --- [           main] .s.a.w.OAuth2AuthorizationEndpointFilter : Authorization request failed: [invalid_request] OAuth 2.0 Parameter: response_type

org.springframework.security.oauth2.server.authorization.authentication.OAuth2AuthorizationCodeRequestAuthenticationException: OAuth 2.0 Parameter: response_type
	at org.springframework.security.oauth2.server.authorization.web.authentication.OAuth2AuthorizationCodeRequestAuthenticationConverter.throwError(OAuth2AuthorizationCodeRequestAuthenticationConverter.java:173) ~[spring-security-oauth2-authorization-server-1.4.1.jar:1.4.1]
	at org.springframework.security.oauth2.server.authorization.web.authentication.OAuth2AuthorizationCodeRequestAuthenticationConverter.throwError(OAuth2AuthorizationCodeRequestAuthenticationConverter.java:168) ~[spring-security-oauth2-authorization-server-1.4.1.jar:1.4.1]
	at org.springframework.security.oauth2.server.authorization.web.authentication.OAuth2AuthorizationCodeRequestAuthenticationConverter.convert(OAuth2AuthorizationCodeRequestAuthenticationConverter.java:81) ~[spring-security-oauth2-authorization-server-1.4.1.jar:1.4.1]
	at org.springframework.security.web.authentication.DelegatingAuthenticationConverter.convert(DelegatingAuthenticationConverter.java:51) ~[spring-security-web-6.4.2.jar:6.4.2]
	at org.springframework.security.oauth2.server.authorization.web.OAuth2AuthorizationEndpointFilter.doFilterInternal(OAuth2AuthorizationEndpointFilter.java:180) ~[spring-security-oauth2-authorization-server-1.4.1.jar:1.4.1]
	at org.springframework.web.filter.OncePerRequestFilter.doFilter(OncePerRequestFilter.java:116) ~[spring-web-6.2.1.jar:6.2.1]
	at org.springframework.security.web.FilterChainProxy$VirtualFilterChain.doFilter(FilterChainProxy.java:374) ~[spring-security-web-6.4.2.jar:6.4.2]
	at org.springframework.security.oauth2.server.authorization.web.OAuth2AuthorizationServerMetadataEndpointFilter.doFilterInternal(OAuth2AuthorizationServerMetadataEndpointFilter.java:90) ~[spring-security-oauth2-authorization-server-1.4.1.jar:1.4.1]
	at org.springframework.web.filter.OncePerRequestFilter.doFilter(OncePerRequestFilter.java:116) ~[spring-web-6.2.1.jar:6.2.1]
	at org.springframework.security.web.FilterChainProxy$VirtualFilterChain.doFilter(FilterChainProxy.java:374) ~[spring-security-web-6.4.2.jar:6.4.2]
	at org.springframework.security.web.authentication.logout.LogoutFilter.doFilter(LogoutFilter.java:107) ~[spring-security-web-6.4.2.jar:6.4.2]
	at org.springframework.security.web.authentication.logout.LogoutFilter.doFilter(LogoutFilter.java:93) ~[spring-security-web-6.4.2.jar:6.4.2]
	at org.springframework.security.web.FilterChainProxy$VirtualFilterChain.doFilter(FilterChainProxy.java:374) ~[spring-security-web-6.4.2.jar:6.4.2]
	at org.springframework.security.oauth2.server.authorization.oidc.web.OidcLogoutEndpointFilter.doFilterInternal(OidcLogoutEndpointFilter.java:105) ~[spring-security-oauth2-authorization-server-1.4.1.jar:1.4.1]
	at org.springframework.web.filter.OncePerRequestFilter.doFilter(OncePerRequestFilter.java:116) ~[spring-web-6.2.1.jar:6.2.1]
	at org.springframework.security.web.FilterChainProxy$VirtualFilterChain.doFilter(FilterChainProxy.java:374) ~[spring-security-web-6.4.2.jar:6.4.2]
	at org.springframework.security.web.csrf.CsrfFilter.doFilterInternal(CsrfFilter.java:117) ~[spring-security-web-6.4.2.jar:6.4.2]
	at org.springframework.web.filter.OncePerRequestFilter.doFilter(OncePerRequestFilter.java:116) ~[spring-web-6.2.1.jar:6.2.1]
	at org.springframework.security.web.FilterChainProxy$VirtualFilterChain.doFilter(FilterChainProxy.java:374) ~[spring-security-web-6.4.2.jar:6.4.2]
	at org.springframework.security.web.header.HeaderWriterFilter.doHeadersAfter(HeaderWriterFilter.java:90) ~[spring-security-web-6.4.2.jar:6.4.2]
	at org.springframework.security.web.header.HeaderWriterFilter.doFilterInternal(HeaderWriterFilter.java:75) ~[spring-security-web-6.4.2.jar:6.4.2]
	at org.springframework.web.filter.OncePerRequestFilter.doFilter(OncePerRequestFilter.java:116) ~[spring-web-6.2.1.jar:6.2.1]
	at org.springframework.security.web.FilterChainProxy$VirtualFilterChain.doFilter(FilterChainProxy.java:374) ~[spring-security-web-6.4.2.jar:6.4.2]
	at org.springframework.security.oauth2.server.authorization.config.annotation.web.configurers.AuthorizationServerContextFilter.doFilterInternal(AuthorizationServerContextFilter.java:69) ~[spring-security-oauth2-authorization-server-1.4.1.jar:1.4.1]
	at org.springframework.web.filter.OncePerRequestFilter.doFilter(OncePerRequestFilter.java:116) ~[spring-web-6.2.1.jar:6.2.1]
	at org.springframework.security.web.FilterChainProxy$VirtualFilterChain.doFilter(FilterChainProxy.java:374) ~[spring-security-web-6.4.2.jar:6.4.2]
	at org.springframework.security.web.context.SecurityContextHolderFilter.doFilter(SecurityContextHolderFilter.java:82) ~[spring-security-web-6.4.2.jar:6.4.2]
	at org.springframework.security.web.context.SecurityContextHolderFilter.doFilter(SecurityContextHolderFilter.java:69) ~[spring-security-web-6.4.2.jar:6.4.2]
	at org.springframework.security.web.FilterChainProxy$VirtualFilterChain.doFilter(FilterChainProxy.java:374) ~[spring-security-web-6.4.2.jar:6.4.2]
	at org.springframework.security.web.context.request.async.WebAsyncManagerIntegrationFilter.doFilterInternal(WebAsyncManagerIntegrationFilter.java:62) ~[spring-security-web-6.4.2.jar:6.4.2]
	at org.springframework.web.filter.OncePerRequestFilter.doFilter(OncePerRequestFilter.java:116) ~[spring-web-6.2.1.jar:6.2.1]
	at org.springframework.security.web.FilterChainProxy$VirtualFilterChain.doFilter(FilterChainProxy.java:374) ~[spring-security-web-6.4.2.jar:6.4.2]
	at org.springframework.security.web.session.DisableEncodeUrlFilter.doFilterInternal(DisableEncodeUrlFilter.java:42) ~[spring-security-web-6.4.2.jar:6.4.2]
	at org.springframework.web.filter.OncePerRequestFilter.doFilter(OncePerRequestFilter.java:116) ~[spring-web-6.2.1.jar:6.2.1]
	at org.springframework.security.web.FilterChainProxy$VirtualFilterChain.doFilter(FilterChainProxy.java:374) ~[spring-security-web-6.4.2.jar:6.4.2]
	at org.springframework.security.web.FilterChainProxy.doFilterInternal(FilterChainProxy.java:233) ~[spring-security-web-6.4.2.jar:6.4.2]
	at org.springframework.security.web.FilterChainProxy.doFilter(FilterChainProxy.java:191) ~[spring-security-web-6.4.2.jar:6.4.2]
	at org.springframework.web.filter.CompositeFilter$VirtualFilterChain.doFilter(CompositeFilter.java:113) ~[spring-web-6.2.1.jar:6.2.1]
	at org.springframework.web.servlet.handler.HandlerMappingIntrospector.lambda$createCacheFilter$3(HandlerMappingIntrospector.java:243) ~[spring-webmvc-6.2.1.jar:6.2.1]
	at org.springframework.web.filter.CompositeFilter$VirtualFilterChain.doFilter(CompositeFilter.java:113) ~[spring-web-6.2.1.jar:6.2.1]
	at org.springframework.web.filter.CompositeFilter.doFilter(CompositeFilter.java:74) ~[spring-web-6.2.1.jar:6.2.1]
	at org.springframework.security.config.annotation.web.configuration.WebMvcSecurityConfiguration$CompositeFilterChainProxy.doFilter(WebMvcSecurityConfiguration.java:238) ~[spring-security-config-6.4.2.jar:6.4.2]
	at org.springframework.web.filter.DelegatingFilterProxy.invokeDelegate(DelegatingFilterProxy.java:362) ~[spring-web-6.2.1.jar:6.2.1]
	at org.springframework.web.filter.DelegatingFilterProxy.doFilter(DelegatingFilterProxy.java:278) ~[spring-web-6.2.1.jar:6.2.1]
	at org.springframework.test.web.servlet.setup.MockMvcFilterDecorator.doFilter(MockMvcFilterDecorator.java:162) ~[spring-test-6.2.1.jar:6.2.1]
	at org.springframework.mock.web.MockFilterChain.doFilter(MockFilterChain.java:132) ~[spring-test-6.2.1.jar:6.2.1]
	at org.springframework.web.filter.RequestContextFilter.doFilterInternal(RequestContextFilter.java:100) ~[spring-web-6.2.1.jar:6.2.1]
	at org.springframework.web.filter.OncePerRequestFilter.doFilter(OncePerRequestFilter.java:116) ~[spring-web-6.2.1.jar:6.2.1]
	at org.springframework.test.web.servlet.setup.MockMvcFilterDecorator.doFilter(MockMvcFilterDecorator.java:162) ~[spring-test-6.2.1.jar:6.2.1]
	at org.springframework.mock.web.MockFilterChain.doFilter(MockFilterChain.java:132) ~[spring-test-6.2.1.jar:6.2.1]
	at org.springframework.web.filter.FormContentFilter.doFilterInternal(FormContentFilter.java:93) ~[spring-web-6.2.1.jar:6.2.1]
	at org.springframework.web.filter.OncePerRequestFilter.doFilter(OncePerRequestFilter.java:116) ~[spring-web-6.2.1.jar:6.2.1]
	at org.springframework.test.web.servlet.setup.MockMvcFilterDecorator.doFilter(MockMvcFilterDecorator.java:162) ~[spring-test-6.2.1.jar:6.2.1]
	at org.springframework.mock.web.MockFilterChain.doFilter(MockFilterChain.java:132) ~[spring-test-6.2.1.jar:6.2.1]
	at org.springframework.web.filter.CharacterEncodingFilter.doFilterInternal(CharacterEncodingFilter.java:201) ~[spring-web-6.2.1.jar:6.2.1]
	at org.springframework.web.filter.OncePerRequestFilter.doFilter(OncePerRequestFilter.java:116) ~[spring-web-6.2.1.jar:6.2.1]
	at org.springframework.test.web.servlet.setup.MockMvcFilterDecorator.doFilter(MockMvcFilterDecorator.java:162) ~[spring-test-6.2.1.jar:6.2.1]
	at org.springframework.mock.web.MockFilterChain.doFilter(MockFilterChain.java:132) ~[spring-test-6.2.1.jar:6.2.1]
	at org.springframework.test.web.servlet.MockMvc.perform(MockMvc.java:201) ~[spring-test-6.2.1.jar:6.2.1]
	at com.example.authserver.AuthServerIntegrationTest.performOidcLoginFlow(AuthServerIntegrationTest.java:32) ~[test-classes/:na]
	at java.base/jdk.internal.reflect.DirectMethodHandleAccessor.invoke(DirectMethodHandleAccessor.java:104) ~[na:na]
	at java.base/java.lang.reflect.Method.invoke(Method.java:565) ~[na:na]
	at org.junit.platform.commons.util.ReflectionUtils.invokeMethod(ReflectionUtils.java:767) ~[junit-platform-commons-1.11.4.jar:1.11.4]
	at org.junit.jupiter.engine.execution.MethodInvocation.proceed(MethodInvocation.java:60) ~[junit-jupiter-engine-5.11.4.jar:5.11.4]
	at org.junit.jupiter.engine.execution.InvocationInterceptorChain$ValidatingInvocation.proceed(InvocationInterceptorChain.java:131) ~[junit-jupiter-engine-5.11.4.jar:5.11.4]
	at org.junit.jupiter.engine.extension.TimeoutExtension.intercept(TimeoutExtension.java:156) ~[junit-jupiter-engine-5.11.4.jar:5.11.4]
	at org.junit.jupiter.engine.extension.TimeoutExtension.interceptTestableMethod(TimeoutExtension.java:147) ~[junit-jupiter-engine-5.11.4.jar:5.11.4]
	at org.junit.jupiter.engine.extension.TimeoutExtension.interceptTestMethod(TimeoutExtension.java:86) ~[junit-jupiter-engine-5.11.4.jar:5.11.4]
	at org.junit.jupiter.engine.execution.InterceptingExecutableInvoker$ReflectiveInterceptorCall.lambda$ofVoidMethod$0(InterceptingExecutableInvoker.java:103) ~[junit-jupiter-engine-5.11.4.jar:5.11.4]
	at org.junit.jupiter.engine.execution.InterceptingExecutableInvoker.lambda$invoke$0(InterceptingExecutableInvoker.java:93) ~[junit-jupiter-engine-5.11.4.jar:5.11.4]
	at org.junit.jupiter.engine.execution.InvocationInterceptorChain$InterceptedInvocation.proceed(InvocationInterceptorChain.java:106) ~[junit-jupiter-engine-5.11.4.jar:5.11.4]
	at org.junit.jupiter.engine.execution.InvocationInterceptorChain.proceed(InvocationInterceptorChain.java:64) ~[junit-jupiter-engine-5.11.4.jar:5.11.4]
	at org.junit.jupiter.engine.execution.InvocationInterceptorChain.chainAndInvoke(InvocationInterceptorChain.java:45) ~[junit-jupiter-engine-5.11.4.jar:5.11.4]
	at org.junit.jupiter.engine.execution.InvocationInterceptorChain.invoke(InvocationInterceptorChain.java:37) ~[junit-jupiter-engine-5.11.4.jar:5.11.4]
	at org.junit.jupiter.engine.execution.InterceptingExecutableInvoker.invoke(InterceptingExecutableInvoker.java:92) ~[junit-jupiter-engine-5.11.4.jar:5.11.4]
	at org.junit.jupiter.engine.execution.InterceptingExecutableInvoker.invoke(InterceptingExecutableInvoker.java:86) ~[junit-jupiter-engine-5.11.4.jar:5.11.4]
	at org.junit.jupiter.engine.descriptor.TestMethodTestDescriptor.lambda$invokeTestMethod$8(TestMethodTestDescriptor.java:217) ~[junit-jupiter-engine-5.11.4.jar:5.11.4]
	at org.junit.platform.engine.support.hierarchical.ThrowableCollector.execute(ThrowableCollector.java:73) ~[junit-platform-engine-1.11.4.jar:1.11.4]
	at org.junit.jupiter.engine.descriptor.TestMethodTestDescriptor.invokeTestMethod(TestMethodTestDescriptor.java:213) ~[junit-jupiter-engine-5.11.4.jar:5.11.4]
	at org.junit.jupiter.engine.descriptor.TestMethodTestDescriptor.execute(TestMethodTestDescriptor.java:138) ~[junit-jupiter-engine-5.11.4.jar:5.11.4]
	at org.junit.jupiter.engine.descriptor.TestMethodTestDescriptor.execute(TestMethodTestDescriptor.java:68) ~[junit-jupiter-engine-5.11.4.jar:5.11.4]
	at org.junit.platform.engine.support.hierarchical.NodeTestTask.lambda$executeRecursively$6(NodeTestTask.java:156) ~[junit-platform-engine-1.11.4.jar:1.11.4]
	at org.junit.platform.engine.support.hierarchical.ThrowableCollector.execute(ThrowableCollector.java:73) ~[junit-platform-engine-1.11.4.jar:1.11.4]
	at org.junit.platform.engine.support.hierarchical.NodeTestTask.lambda$executeRecursively$8(NodeTestTask.java:146) ~[junit-platform-engine-1.11.4.jar:1.11.4]
	at org.junit.platform.engine.support.hierarchical.Node.around(Node.java:137) ~[junit-platform-engine-1.11.4.jar:1.11.4]
	at org.junit.platform.engine.support.hierarchical.NodeTestTask.lambda$executeRecursively$9(NodeTestTask.java:144) ~[junit-platform-engine-1.11.4.jar:1.11.4]
	at org.junit.platform.engine.support.hierarchical.ThrowableCollector.execute(ThrowableCollector.java:73) ~[junit-platform-engine-1.11.4.jar:1.11.4]
	at org.junit.platform.engine.support.hierarchical.NodeTestTask.executeRecursively(NodeTestTask.java:143) ~[junit-platform-engine-1.11.4.jar:1.11.4]
	at org.junit.platform.engine.support.hierarchical.NodeTestTask.execute(NodeTestTask.java:100) ~[junit-platform-engine-1.11.4.jar:1.11.4]
	at java.base/java.util.ArrayList.forEach(ArrayList.java:1604) ~[na:na]
	at org.junit.platform.engine.support.hierarchical.SameThreadHierarchicalTestExecutorService.invokeAll(SameThreadHierarchicalTestExecutorService.java:41) ~[junit-platform-engine-1.11.4.jar:1.11.4]
	at org.junit.platform.engine.support.hierarchical.NodeTestTask.lambda$executeRecursively$6(NodeTestTask.java:160) ~[junit-platform-engine-1.11.4.jar:1.11.4]
	at org.junit.platform.engine.support.hierarchical.ThrowableCollector.execute(ThrowableCollector.java:73) ~[junit-platform-engine-1.11.4.jar:1.11.4]
	at org.junit.platform.engine.support.hierarchical.NodeTestTask.lambda$executeRecursively$8(NodeTestTask.java:146) ~[junit-platform-engine-1.11.4.jar:1.11.4]
	at org.junit.platform.engine.support.hierarchical.Node.around(Node.java:137) ~[junit-platform-engine-1.11.4.jar:1.11.4]
	at org.junit.platform.engine.support.hierarchical.NodeTestTask.lambda$executeRecursively$9(NodeTestTask.java:144) ~[junit-platform-engine-1.11.4.jar:1.11.4]
	at org.junit.platform.engine.support.hierarchical.ThrowableCollector.execute(ThrowableCollector.java:73) ~[junit-platform-engine-1.11.4.jar:1.11.4]
	at org.junit.platform.engine.support.hierarchical.NodeTestTask.executeRecursively(NodeTestTask.java:143) ~[junit-platform-engine-1.11.4.jar:1.11.4]
	at org.junit.platform.engine.support.hierarchical.NodeTestTask.execute(NodeTestTask.java:100) ~[junit-platform-engine-1.11.4.jar:1.11.4]
	at java.base/java.util.ArrayList.forEach(ArrayList.java:1604) ~[na:na]
	at org.junit.platform.engine.support.hierarchical.SameThreadHierarchicalTestExecutorService.invokeAll(SameThreadHierarchicalTestExecutorService.java:41) ~[junit-platform-engine-1.11.4.jar:1.11.4]
	at org.junit.platform.engine.support.hierarchical.NodeTestTask.lambda$executeRecursively$6(NodeTestTask.java:160) ~[junit-platform-engine-1.11.4.jar:1.11.4]
	at org.junit.platform.engine.support.hierarchical.ThrowableCollector.execute(ThrowableCollector.java:73) ~[junit-platform-engine-1.11.4.jar:1.11.4]
	at org.junit.platform.engine.support.hierarchical.NodeTestTask.lambda$executeRecursively$8(NodeTestTask.java:146) ~[junit-platform-engine-1.11.4.jar:1.11.4]
	at org.junit.platform.engine.support.hierarchical.Node.around(Node.java:137) ~[junit-platform-engine-1.11.4.jar:1.11.4]
	at org.junit.platform.engine.support.hierarchical.NodeTestTask.lambda$executeRecursively$9(NodeTestTask.java:144) ~[junit-platform-engine-1.11.4.jar:1.11.4]
	at org.junit.platform.engine.support.hierarchical.ThrowableCollector.execute(ThrowableCollector.java:73) ~[junit-platform-engine-1.11.4.jar:1.11.4]
	at org.junit.platform.engine.support.hierarchical.NodeTestTask.executeRecursively(NodeTestTask.java:143) ~[junit-platform-engine-1.11.4.jar:1.11.4]
	at org.junit.platform.engine.support.hierarchical.NodeTestTask.execute(NodeTestTask.java:100) ~[junit-platform-engine-1.11.4.jar:1.11.4]
	at org.junit.platform.engine.support.hierarchical.SameThreadHierarchicalTestExecutorService.submit(SameThreadHierarchicalTestExecutorService.java:35) ~[junit-platform-engine-1.11.4.jar:1.11.4]
	at org.junit.platform.engine.support.hierarchical.HierarchicalTestExecutor.execute(HierarchicalTestExecutor.java:57) ~[junit-platform-engine-1.11.4.jar:1.11.4]
	at org.junit.platform.engine.support.hierarchical.HierarchicalTestEngine.execute(HierarchicalTestEngine.java:54) ~[junit-platform-engine-1.11.4.jar:1.11.4]
	at org.junit.platform.launcher.core.EngineExecutionOrchestrator.execute(EngineExecutionOrchestrator.java:198) ~[junit-platform-launcher-1.11.4.jar:1.11.4]
	at org.junit.platform.launcher.core.EngineExecutionOrchestrator.execute(EngineExecutionOrchestrator.java:169) ~[junit-platform-launcher-1.11.4.jar:1.11.4]
	at org.junit.platform.launcher.core.EngineExecutionOrchestrator.execute(EngineExecutionOrchestrator.java:93) ~[junit-platform-launcher-1.11.4.jar:1.11.4]
	at org.junit.platform.launcher.core.EngineExecutionOrchestrator.lambda$execute$0(EngineExecutionOrchestrator.java:58) ~[junit-platform-launcher-1.11.4.jar:1.11.4]
	at org.junit.platform.launcher.core.EngineExecutionOrchestrator.withInterceptedStreams(EngineExecutionOrchestrator.java:141) ~[junit-platform-launcher-1.11.4.jar:1.11.4]
	at org.junit.platform.launcher.core.EngineExecutionOrchestrator.execute(EngineExecutionOrchestrator.java:57) ~[junit-platform-launcher-1.11.4.jar:1.11.4]
	at org.junit.platform.launcher.core.DefaultLauncher.execute(DefaultLauncher.java:103) ~[junit-platform-launcher-1.11.4.jar:1.11.4]
	at org.junit.platform.launcher.core.DefaultLauncher.execute(DefaultLauncher.java:85) ~[junit-platform-launcher-1.11.4.jar:1.11.4]
	at org.junit.platform.launcher.core.DelegatingLauncher.execute(DelegatingLauncher.java:47) ~[junit-platform-launcher-1.11.4.jar:1.11.4]
	at org.apache.maven.surefire.junitplatform.LazyLauncher.execute(LazyLauncher.java:56) ~[surefire-junit-platform-3.5.2.jar:3.5.2]
	at org.apache.maven.surefire.junitplatform.JUnitPlatformProvider.execute(JUnitPlatformProvider.java:184) ~[surefire-junit-platform-3.5.2.jar:3.5.2]
	at org.apache.maven.surefire.junitplatform.JUnitPlatformProvider.invokeAllTests(JUnitPlatformProvider.java:148) ~[surefire-junit-platform-3.5.2.jar:3.5.2]
	at org.apache.maven.surefire.junitplatform.JUnitPlatformProvider.invoke(JUnitPlatformProvider.java:122) ~[surefire-junit-platform-3.5.2.jar:3.5.2]
	at org.apache.maven.surefire.booter.ForkedBooter.runSuitesInProcess(ForkedBooter.java:385) ~[surefire-booter-3.5.2.jar:3.5.2]
	at org.apache.maven.surefire.booter.ForkedBooter.execute(ForkedBooter.java:162) ~[surefire-booter-3.5.2.jar:3.5.2]
	at org.apache.maven.surefire.booter.ForkedBooter.run(ForkedBooter.java:507) ~[surefire-booter-3.5.2.jar:3.5.2]
	at org.apache.maven.surefire.booter.ForkedBooter.main(ForkedBooter.java:495) ~[surefire-booter-3.5.2.jar:3.5.2]

2026-02-12T00:33:05.418-03:00 TRACE 3361 --- [           main] o.s.s.w.header.writers.HstsHeaderWriter  : Not injecting HSTS header since it did not match request to [Is Secure]

MockHttpServletRequest:
      HTTP Method = GET
      Request URI = /oauth2/authorize
       Parameters = {response_type=[code], client_id=[oidc-client], scope=[openid profile], state=[some-state], redirect_uri=[http://127.0.0.1:8080/login/oauth2/code/oidc-client]}
          Headers = []
             Body = null
    Session Attrs = {}

Handler:
             Type = null

Async:
    Async started = false
     Async result = null

Resolved Exception:
             Type = null

ModelAndView:
        View name = null
             View = null
            Model = null

FlashMap:
       Attributes = null

MockHttpServletResponse:
           Status = 400
    Error message = [invalid_request] OAuth 2.0 Parameter: response_type
          Headers = [X-Content-Type-Options:"nosniff", X-XSS-Protection:"0", Cache-Control:"no-cache, no-store, max-age=0, must-revalidate", Pragma:"no-cache", Expires:"0", X-Frame-Options:"DENY"]
     Content type = null
             Body = 
    Forwarded URL = null
   Redirected URL = null
          Cookies = []
[ERROR] Tests run: 1, Failures: 1, Errors: 0, Skipped: 0, Time elapsed: 1.560 s <<< FAILURE! -- in com.example.authserver.AuthServerIntegrationTest
[ERROR] com.example.authserver.AuthServerIntegrationTest.performOidcLoginFlow -- Time elapsed: 0.409 s <<< FAILURE!
java.lang.AssertionError: Range for response status value 400 expected:<REDIRECTION> but was:<CLIENT_ERROR>
	at org.springframework.test.util.AssertionErrors.fail(AssertionErrors.java:61)
	at org.springframework.test.util.AssertionErrors.assertEquals(AssertionErrors.java:128)
	at org.springframework.test.web.servlet.result.StatusResultMatchers.lambda$is3xxRedirection$4(StatusResultMatchers.java:88)
	at org.springframework.test.web.servlet.MockMvc$1.andExpect(MockMvc.java:214)
	at com.example.authserver.AuthServerIntegrationTest.performOidcLoginFlow(AuthServerIntegrationTest.java:39)
	at java.base/java.lang.reflect.Method.invoke(Method.java:565)
	at java.base/java.util.ArrayList.forEach(ArrayList.java:1604)
	at java.base/java.util.ArrayList.forEach(ArrayList.java:1604)

[INFO] Running com.example.authserver.DebugRepositoryTest
2026-02-12T00:33:05.433-03:00  INFO 3361 --- [           main] t.c.s.AnnotationConfigContextLoaderUtils : Could not detect default configuration classes for test class [com.example.authserver.DebugRepositoryTest]: DebugRepositoryTest does not declare any static, non-private, non-final, nested classes annotated with @Configuration.
2026-02-12T00:33:05.434-03:00  INFO 3361 --- [           main] .b.t.c.SpringBootTestContextBootstrapper : Found @SpringBootConfiguration com.example.authserver.AuthServerApplication for test class com.example.authserver.DebugRepositoryTest

  .   ____          _            __ _ _
 /\\ / ___'_ __ _ _(_)_ __  __ _ \ \ \ \
( ( )\___ | '_ | '_| | '_ \/ _` | \ \ \ \
 \\/  ___)| |_)| | | | | || (_| |  ) ) ) )
  '  |____| .__|_| |_|_| |_\__, | / / / /
 =========|_|==============|___/=/_/_/_/

 :: Spring Boot ::                (v3.4.1)

2026-02-12T00:33:05.449-03:00  INFO 3361 --- [           main] c.e.authserver.DebugRepositoryTest       : Starting DebugRepositoryTest using Java 25.0.2 with PID 3361 (started by fabian in /Users/fabian/Documents/CodeProjects/github.com/fabiankaraben/java-mini-projects/advanced/41-custom-identity-provider)
2026-02-12T00:33:05.449-03:00  INFO 3361 --- [           main] c.e.authserver.DebugRepositoryTest       : No active profile set, falling back to 1 default profile: "default"
2026-02-12T00:33:05.504-03:00 TRACE 3361 --- [           main] eGlobalAuthenticationAutowiredConfigurer : Eagerly initializing {securityConfig=com.example.authserver.config.SecurityConfig$$SpringCGLIB$$0@1c53bd49}
2026-02-12T00:33:05.504-03:00  WARN 3361 --- [           main] o.s.security.core.userdetails.User       : User.withDefaultPasswordEncoder() is considered unsafe for production and is only intended for sample applications.
2026-02-12T00:33:05.579-03:00  INFO 3361 --- [           main] r$InitializeUserDetailsManagerConfigurer : Global AuthenticationManager configured with UserDetailsService bean with name userDetailsService
2026-02-12T00:33:05.702-03:00 DEBUG 3361 --- [           main] o.s.s.web.DefaultSecurityFilterChain     : Will secure org.springframework.security.oauth2.server.authorization.config.annotation.web.configurers.OAuth2AuthorizationServerConfigurer$$Lambda/0x00001000013f1ab8@ace2408 with filters: DisableEncodeUrlFilter, WebAsyncManagerIntegrationFilter, SecurityContextHolderFilter, AuthorizationServerContextFilter, HeaderWriterFilter, CsrfFilter, OidcLogoutEndpointFilter, LogoutFilter, OAuth2AuthorizationServerMetadataEndpointFilter, OAuth2AuthorizationEndpointFilter, OAuth2DeviceVerificationEndpointFilter, OidcProviderConfigurationEndpointFilter, NimbusJwkSetEndpointFilter, OAuth2ClientAuthenticationFilter, BearerTokenAuthenticationFilter, RequestCacheAwareFilter, SecurityContextHolderAwareRequestFilter, AnonymousAuthenticationFilter, ExceptionTranslationFilter, AuthorizationFilter, OAuth2TokenEndpointFilter, OAuth2TokenIntrospectionEndpointFilter, OAuth2TokenRevocationEndpointFilter, OAuth2DeviceAuthorizationEndpointFilter, OidcUserInfoEndpointFilter
2026-02-12T00:33:05.704-03:00 DEBUG 3361 --- [           main] o.s.s.web.DefaultSecurityFilterChain     : Will secure any request with filters: DisableEncodeUrlFilter, WebAsyncManagerIntegrationFilter, SecurityContextHolderFilter, HeaderWriterFilter, CsrfFilter, LogoutFilter, UsernamePasswordAuthenticationFilter, DefaultResourcesFilter, DefaultLoginPageGeneratingFilter, DefaultLogoutPageGeneratingFilter, RequestCacheAwareFilter, SecurityContextHolderAwareRequestFilter, AnonymousAuthenticationFilter, ExceptionTranslationFilter, AuthorizationFilter
2026-02-12T00:33:05.722-03:00  INFO 3361 --- [           main] c.e.authserver.DebugRepositoryTest       : Started DebugRepositoryTest in 0.287 seconds (process running for 2.089)
[INFO] Tests run: 1, Failures: 0, Errors: 0, Skipped: 0, Time elapsed: 0.317 s -- in com.example.authserver.DebugRepositoryTest
[INFO] 
[INFO] Results:
[INFO] 
[ERROR] Failures: 
[ERROR]   AuthServerIntegrationTest.performOidcLoginFlow:39 Range for response status value 400 expected:<REDIRECTION> but was:<CLIENT_ERROR>
[INFO] 
[ERROR] Tests run: 2, Failures: 1, Errors: 0, Skipped: 0
[INFO] 
[INFO] ------------------------------------------------------------------------
[INFO] BUILD FAILURE
[INFO] ------------------------------------------------------------------------
[INFO] Total time:  3.393 s
[INFO] Finished at: 2026-02-12T00:33:05-03:00
[INFO] ------------------------------------------------------------------------
[ERROR] Failed to execute goal org.apache.maven.plugins:maven-surefire-plugin:3.5.2:test (default-test) on project custom-identity-provider: There are test failures.
[ERROR] 
[ERROR] See /Users/fabian/Documents/CodeProjects/github.com/fabiankaraben/java-mini-projects/advanced/41-custom-identity-provider/target/surefire-reports for the individual test results.
[ERROR] See dump files (if any exist) [date].dump, [date]-jvmRun[N].dump and [date].dumpstream.
[ERROR] -> [Help 1]
[ERROR] 
[ERROR] To see the full stack trace of the errors, re-run Maven with the -e switch.
[ERROR] Re-run Maven using the -X switch to enable full debug logging.
[ERROR] 
[ERROR] For more information about the errors and possible solutions, please read the following articles:
[ERROR] [Help 1] http://cwiki.apache.org/confluence/display/MAVEN/MojoFailureException
